{
  "schemaVersion": "animation-plan.v1", "title": "Listener candidate", "durationMs": 30000,
  "safetyMode": "offline_review_only", "targetRig": "david_delegate_local_svg_v0",
  "tracks": {
    "states": [
      { "id": "s1", "type": "state", "startMs": 0, "durationMs": 29000, "state": "listening" },
      { "id": "s2", "type": "state", "startMs": 29000, "durationMs": 1000, "state": "reset_neutral" }
    ],
    "gestures": [
      { "id": "g1", "type": "gesture", "startMs": 8000, "durationMs": 500, "gesture": "micro_nod" },
      { "id": "g2", "type": "gesture", "startMs": 20000, "durationMs": 500, "gesture": "micro_nod" }
    ],
    "overlays": [{ "id": "o1", "type": "overlay", "startMs": 0, "durationMs": 30000, "text": "AI Delegate — offline review" }]
  }
}
