{
  "schemaVersion": "animation-plan.v1", "title": "Clarification candidate", "durationMs": 16000,
  "safetyMode": "offline_review_only", "targetRig": "david_delegate_local_svg_v0",
  "tracks": {
    "states": [
      { "id": "s1", "type": "state", "startMs": 0, "durationMs": 4000, "state": "listening" },
      { "id": "s2", "type": "state", "startMs": 4000, "durationMs": 4000, "state": "thinking" },
      { "id": "s3", "type": "state", "startMs": 8000, "durationMs": 3000, "state": "uncertain" },
      { "id": "s4", "type": "state", "startMs": 11000, "durationMs": 4000, "state": "speaking" },
      { "id": "s5", "type": "state", "startMs": 15000, "durationMs": 1000, "state": "reset_neutral" }
    ], "gestures": [],
    "speech": [{ "id": "p1", "type": "speech", "startMs": 11000, "speechAct": "clarifying_question", "text": "Which context applies?" }],
    "overlays": [{ "id": "o1", "type": "overlay", "startMs": 0, "durationMs": 16000, "text": "AI Delegate — offline review" }]
  }
}
